Commodity code,Commodity,Quantity,Unit,Supplimentary Quantity,Supplimentary Unit,US dollar
32149000,"Non-refractory surfacing prep. for facades, indoor walls, walls/the like",5595463,-,0,-,"12,797,393"
32151100,"Black printing ink, whether or not concentrated or solid",2371623,-,0,-,"54,950,858"
32151900,"Printing ink, whether or not concentrated or solid (excl. black)",15050379,-,0,-,"258,437,875"
32159010,Writing or drawing inks,4690553,-,0,-,"30,851,856"
32159020,Water-based inkjet inks,4817797,-,0,-,"102,118,215"
32159090,"Inks, nes",4872557,-,0,-,"66,659,429"
33011200,Essential oils of orange,1903029,-,0,-,"28,643,454"
33011300,Essential oils of lemon,596075,-,0,-,"22,603,937"
33011910,Essential oils of lime,119779,-,0,-,"7,064,985"
33011990,"Essential oils of citrus fruit, nes",143401,-,0,-,"12,656,563"
33012400,Essential oils of peppermint,287188,-,0,-,"15,331,134"
33012500,"Essential oils of mints, nes",1676637,-,0,-,"28,438,775"
33012910,Essential oils of camphor,352,-,0,-,"6,865"
33012920,Essential oils of citronella,20451,-,0,-,"573,714"
33012930,Essential oils of aniseed,3179,-,0,-,"198,615"
33012940,Essential oils of cassia,64027,-,0,-,"2,401,650"
33012950,Essential oils of litsea cubeba,1929,-,0,-,"159,735"
33012960,Essential oils of eucalyptus,13893,-,0,-,"476,854"
33012991,Essential oils of geranium,4855,-,0,-,"431,384"
33012999,"Essential oils other than of citrus fruit, nes",1132982,-,0,-,"56,358,391"
33013010,Balsam of irises,101,-,0,-,"115,172"
33013090,Other resinoids,17661,-,0,-,"621,858"
33019010,Extracted oleoresins,700952,-,0,-,"12,616,913"
33019020,Terpenic byproducts deterpenatn of citrus fruit essential oils,664895,-,0,-,"5,609,848"
33019090,"Concentrats in fats, etc.;terpenicby prdcts,aqs distillates;  of essencial oils",1509916,-,0,-,"10,095,325"
33021010,"Mixtures of odoriferous substancs for drink industries, alcohol v.¡Ü0.5%",1798313,-,0,-,"74,260,316"
33021090,"Mixtures of odoriferous substancs for food or drink industries, nes",8607349,-,0,-,"185,543,835"
33029000,"Mixtures of odoriferous substances as raw materials in industry, nes",9861630,-,0,-,"188,666,932"
33030000,Perfumes&toilet waters,1222047,-,28346799,-,"261,767,235"
33041000,Lip make-up prep.,1213698,-,89347951,-,"448,306,844"
33042000,Eye make-up prep.,799058,-,38840140,-,"133,245,065"
33043000,Manicure or pedicure prep.,258446,-,1415958,-,"4,759,666"
33049100,"Powders, whether or not compressed, for cosmetic/toilet use",1178349,-,18912677,-,"144,360,505"
33049900,"Beauty, make-up, skin-care (incl. suntan), nes",112528955,-,2072166670,-,"5,089,513,465"
33051000,Shampoos,28418928,-,0,-,"183,842,298"
33052000,Preparations for permanent waving or straightening,391687,-,0,-,"2,678,514"
33053000,Hair lacquers,444358,-,0,-,"4,771,535"
33059000,"Preparations for use on the hair, nes",14459854,-,0,-,"156,463,983"
33061010,Toothpastes,18014043,-,0,-,"133,285,022"
33061090,Dentifrices other than toothpaste,1041072,-,0,-,"11,457,563"
33062000,Dental floss,589927,-,0,-,"5,862,647"
33069000,"Preparations for oral or dental hygiene, nes",11557153,-,0,-,"34,438,720"
33071000,"Pre-shave, shaving or after-shave prep.",654675,-,0,-,"5,953,805"
33072000,Personal deodorants&antiperspirants,179407,-,0,-,"6,568,772"
33073000,Perfumed bath salts&other bath prep.,29780908,-,0,-,"151,928,654"
33074100,Agarbatti&other odiferous prep. which operate by burning,1307068,-,0,-,"4,091,413"
33074900,"Preparations for deodorizing rooms, nes",5738957,-,0,-,"69,576,616"
33079000,"Other perfumery, cosmetic or toilet prep., nes",19468759,-,0,-,"152,262,721"
34011100,"Soap&organic surface-active prdct in bars, etc, for toilet use",11335418,-,0,-,"60,492,599"
34011910,"Laundry soap,in bars, etc",12492725,-,0,-,"23,915,288"
34011990,"Soap&organic surface-active prdcts in bars, etc, nes",11525369,-,0,-,"19,064,336"
34012000,"Soap in other forms, nes",87253643,-,0,-,"70,079,896"
34013000,Organic surface-active products and preparations for washing the skin,6233785,-,0,-,"104,391,601"
34021100,"Anionic surface-active agents, (excl. soap)",66506200,-,0,-,"152,538,205"
34021200,"Cationic surface-active agents, (excl. soap)",6188597,-,0,-,"24,058,775"
34021300,"Non-ionic surface-active agents, (excl. soap)",190917583,-,0,-,"478,776,930"
34021900,"Organic surface-active agents, (excl. soap), nes",6034406,-,0,-,"15,203,674"
34022010,"Synthetic detergent powder, put up for retail sale",9429762,-,0,-,"13,868,870"
34022090,"Washing&cleaning prep., put up for retail sale, nes",98649989,-,0,-,"333,809,126"
34029000,"Washing & cleaning prep.s, not put up for retail sale",123464476,-,0,-,"447,523,730"
34031100,"Lubricating prep.for trtmnt of textiles/othr mttr, with<70% petro./btmns oil",77424132,-,0,-,"183,277,524"
34031900,"Other lubricating prep., with<70% petro./btmns oil, nes",111024697,-,0,-,"566,474,244"
34039100,"Lubricating prep. for trtmnt of textiles/othr mttr, no petro./btmns oil",174028061,-,0,-,"437,713,782"
34039900,"Other lubricating prep., nes, no petro./btmns oil",131945995,-,0,-,"793,422,125"
34042000,Artificial waxes of polyethylene glycol,20392564,-,0,-,"48,301,997"
34049000,"Artificial waxes&prepared waxes, nes",176067051,-,0,-,"365,116,135"
34051000,"Polishes, creams&similar prep. for footwear or leather",1970473,-,0,-,"12,209,747"
34052000,"Polishes, creams&similar prep. for maintenance of woodwork",1550524,-,0,-,"10,938,549"
34053000,Polishes&similar prep. for coachwork (excl. metal polishes),4500867,-,0,-,"23,421,576"
34054000,Scouring pastes&powders&other scouring prep.,1890355,-,0,-,"8,480,174"
34059000,"Other polishes, creams&similar prep., nes",41498009,-,0,-,"218,735,374"
34060000,"Candles, tapers&the like",1936860,-,0,-,"12,271,768"
34070010,Dental wax or dental impression compounds,957831,-,0,-,"14,917,373"
34070020,Other preparations with a basis of plaster for dentistry,868792,-,0,-,"10,943,298"
34070090,Modelling pastes,2369301,-,0,-,"10,572,677"
35011000,Casein,4676800,-,0,-,"33,386,651"
35019000,Caseinates&other casein derivatives; casein glues,13974609,-,0,-,"112,035,138"
35021100,"Egg albumin, dried",2771,-,0,-,"191,384"
35021900,Egg albumin other than dried,1,-,0,-,"5,704"
35022000,Milk albumin,23135206,-,0,-,"199,983,613"
35029000,"Albumins, albuminates&other dreivatives, nes",41453,-,0,-,"2,562,998"
35030010,Gelatin&derivatives,2119012,-,0,-,"13,436,934"
35030090,Isinglass; other glues of animal origin,206928,-,0,-,"2,999,746"
35040010,Peptones&derivatives,1246488,-,0,-,"11,788,587"
35040090,"Protein substances&derivatives, nes; hide powder",9879837,-,0,-,"53,912,070"
35051000,Dextrins&other modified starches,389420027,-,0,-,"335,238,019"
35052000,"Glues based on starches, dextrins or other modified starches",1011349,-,0,-,"1,817,608"
35061000,Products put up as glues or adhesives for retail sale wt.¡Ü1kg,8272986,-,0,-,"430,306,868"
35069110,Adhesives based on polyamide,3149346,-,0,-,"22,733,573"
35069120,Adhesives based on epoxy resin,10834841,-,0,-,"184,413,255"
35069190,"Adhesives based on rubber or plastic, nes",163881934,-,0,-,"1,561,271,339"
35069900,"Prepared glues&other prepared adhesives, nes",21096325,-,0,-,"148,926,900"
35071000,Rennet&concentrates thereof,1118,-,0,-,"131,232"
35079010,Basic proteinase,1988154,-,0,-,"10,490,943"
35079020,Basic lipase,110247,-,0,-,"3,333,181"
35079090,"Other Enzymes; prepared enzymes, nes",13267988,-,0,-,"226,193,480"
36010000,Propellent powders,829418,-,0,-,"34,174,568"
36020090,"Prepared explosives (excl. propellent powders), nes",1850,-,0,-,"8,047"
36030000,Safety&detonating fuses; percussion caps; igniters; electric detonators,857928,-,0,-,"117,776,614"
36041000,Fireworks,41892,-,0,-,"3,511,496"
36049000,"Signalling flares, rain rockets, fog signaols& other pyrotechnic articles",1910,-,0,-,"273,820"
36050000,Matches (excl. pyrotechnic articles of 36.04),4340,-,0,-,"6,843"
36061000,"Liquid or liquefied-gas fuels in container¡Ü300cm3, for lighters,",1051465,-,0,-,"5,587,756"
36069011,"Ferro-cerium&pyrophoric alloys, cut to shape for immediate use",64954,-,0,-,"2,897,589"
36069090,"Other articles of combustible materials, nes",1431,-,0,-,"7,117"
37011000,"Photographic plates&flat film , for X-ray, sensitized, unexposed",439768,-,1375866,-,"16,135,267"
37012000,"Instant print flat film, unexposed",342477,-,0,-,"19,537,735"
37013021,"Laser phototypesetting film, unexposed, any side>255mm",196401,-,765976,-,"4,325,733"
37013022,"Precoated sensitized plate, unexposed, any side>255mm",38629,-,54585,-,"412,614"
37013024,"CTP plate,unexposed, any side>255mm",205616,-,219936,-,"3,415,930"
37013025,Flexographic printing plates,1074280,-,480522,-,"29,037,685"
37013029,"Othr photo plates&film, unexposed, any side>255mm, for printing plates,",2369880,-,1517795,-,"41,462,855"
37013090,"Photo plates&film, unexposed, any side>255mm, nes",484029,-,1710976,-,"7,794,519"
37019100,"Colour photo plates&flat film, unexposed",15811,-,0,-,"430,563"
37019920,"Photographic plates&flat film , unexposed, for printing plates/cylinders",66191,-,24315,-,"38,153,820"
37019990,"Photographic plates&flat film, unexposed, nes",28146,-,97031,-,"531,369"
37021000,"Photographic film in rolls, for X-ray, unexposed",3181260,-,12535286,-,"62,857,185"
37023110,"Instant print color photo film in rolls, unexpsd,unperforated,w.¡Ü105mm",20,-,3,-,613
37023190,"Colour photo film rolls,unexpsd,unperforated,w¡Ü105mm,nes",54924,-,9376,-,"213,169"
37023210,"Instant print film rolls, unexpsd, unperforated, slvr hal. emul., w.¡Ü105mm",1302,-,780,-,"75,489"
37023220,"Printing plate film rolls,unexpsd, unperforated, slvr hal. emul., w.¡Ü105mm",8540,-,40880,-,"280,792"
37023290,"Photo film rolls,unexpsd, unperforated, slvr hal. emul., w.¡Ü105mm, nes",6273,-,23199,-,"480,184"
37023920,"Printing plate film rolls,unexpsd, unperforated,, w.¡Ü105mm, nes",545,-,4081,-,"23,198"
37023990,"Othr photo film rolls, unexpsd, unperforated, w.¡Ü105mm, nes",84,-,884,-,"15,485"
37024221,"W. anticorrosive plate for prntd circuit processing, w.>610mm, l.>200m",1461422,-,18131899,-,"19,928,641"
37024229,"Printing plate flm rolls,un-expsd/prfrtd,not color,w.>610mm,l.>200m,nes",5212986,-,25242298,-,"94,137,565"
37024292,"Red or infra-red laser film, unexposed w.>610mm, l.>200m",14237832,-,57766728,-,"345,702,147"
37024299,"Photo film rolls, unexpsd, unperforated, not color, w.>610mm, l.>200m,nes",592,-,3952,-,"6,848"
37024321,"Laser phototypesetting film, unexpsd, unperforated,, w.>610mm, l.¡Ü200m",17742,-,116935,-,"396,936"
37024329,"Printing plate flm rolls,, unexpsd, unperforated,, w.>610mm, l.¡Ü200m,nes",52377,-,308283,-,"2,298,106"
37024390,"Othr photo film rolls, unexpsd, unperforated, w.>610mm, l.¡Ü200m ,nes",77720,-,209978,-,"1,842,490"
37024421,"Laser phototypesetting film, unexpsd, unperforated, 105mm<w.¡Ü610mm",614951,-,2464390,-,"12,164,608"
37024422,"Narrow anticorrosive plate for prntd circuit processing, 105<w.¡Ü610 mm",188224,-,2044424,-,"10,188,842"
37024429,"Printing plate flm rolls, unexpsd, unperforated, 105mm<w.¡Ü610mm",15403,-,60565,-,"1,389,668"
37024490,"Photo film rolls, unexpsd, unperforated, 105mm<w.¡Ü610mm, nes",16672,-,35330,-,"7,794,490"
37025200,"Colour films rolls, unexpsd, w.£¼mm",83022,-,1328,-,"134,469"
37025300,"Colour slide film rolls,unexpsd, 16mm<w.¡Ü35mm, l.¡Ü30m",9252,-,323,-,"26,617"
37025410,"Colour film rolls,unexpsd, width=35mm, length¡Ü2m, not for slides",7163866,-,250709,-,"6,103,577"
37025490,"Colour film rolls, unexpsd,16mm<w.¡Ü35mm, l.¡Ü30m, not for slides, nes",12481,-,436,-,"138,403"
37025520,"Colour cinema film rolls,unexpsd, 16mm<w.¡Ü35mm, l.£¾30m",3755093,-,131428,-,"408,495"
37025590,"Colour film rolls,unexpsd, 16mm<w.¡Ü35mm, l.£¾30m, nes",25490,-,892,-,"10,121"
37025620,"Colour cinema film rolls, unexpsd, width£¾35mm",11606,-,417,-,"5,745"
37025690,"Colour film in rolls, unexposed, width£¾35mm, nes",83101,-,5090,-,"132,724"
37029600,"Other rolls, unexposed, w.¡Ü35mm, l.¡Ü30m,",114830,-,4021,-,"122,589"
37029700,"Other rolls, unexposed, w.¡Ü35mm, l.£¾30m,",22830,-,785,-,"22,129"
37031010,"Photo paper&paperboard in rolls, unexposed, width>610mm",9679155,-,0,-,"42,655,608"
37031090,"Photographic textiles in rolls,unexposed, width>610mm",9,-,0,-,362
37032010,"Other colour photo paper and paperboard, unexposed",21787,-,0,-,"308,554"
37039010,"Other photographic paper&paperboard, unexposed",926,-,0,-,"51,983"
37039090,"Other photographic textiles,unexposed",9,-,0,-,455
37040090,"Photo plates/film/paper/paperboard/textiles, exposed, not developed, nes",4551,-,0,-,"102,483"
37050010,"Lantern slides, exposed/developed, for educational use only",329,-,0,-,"15,319"
37050021,"Exposed/developed microfilms, for printed books and newspapers",189,-,0,-,"696,332"
37050029,Other exposed/developed microfilms,995,-,0,-,"134,721"
37050090,"Other exposed/developed photo plates/films, excl. cinema film",37788,-,0,-,"32,116,593"
37061010,"Cinema film, exposed&developed, width¡Ý35mm, for educational use",60,-,4420,-,"17,200"
37061090,"Other cinema film, exposed&developed, width¡Ý35mm",3967,-,529491,-,"1,589,720"
37071000,Sensitising emulsions for photographic uses,23008698,-,0,-,"985,661,378"
37079010,Chemical prep. for developing photo film/paper,1779359,-,0,-,"3,611,696"
37079020,Chemical prep. for photo-copying machines,9106617,-,0,-,"169,533,002"
37079090,"Other chemical prep.&unmixed prdcts(ready for use) for photograph, nes",31557893,-,0,-,"408,244,447"
38011000,Artificial graphite,20653499,-,0,-,"144,763,988"
38012000,Colloidal graphite or semi-colloidal graphite,1132031,-,0,-,"6,370,043"
38013000,Carbonaceous pastes for electrodes&pastes for furnace linings,220772,-,0,-,"1,960,575"
38019010,Spheroidized graphite by surface treatment,491418,-,0,-,"3,456,089"
38019090,Preparations of graphite or carbon in form of semimanufactures nes,6845166,-,0,-,"97,667,999"
38021010,Wood-based activated carbon,17842543,-,0,-,"67,441,838"
38021090,Other activated carbon,16047759,-,0,-,"48,410,921"
38029000,Activated natural mineral prod.s; animal black,12240406,-,0,-,"22,123,343"
38030000,"Tall oil, whether or not refined",20223299,-,0,-,"12,786,673"
38040000,Residual lyes from the manufacture of wood pulp (excl. tall oil),61544102,-,0,-,"36,937,859"
38051000,"Gum, wood or sulphate turpentine oils",5035646,-,0,-,"10,912,103"
38059010,Pine oil containing alpha-terpined as the main constituent,276300,-,0,-,"1,064,751"
38059090,Other turpenic oils; crude dipentene; sulphite turpentine; crude paracymene,201940,-,0,-,"254,540"
38061010,Rosin,55256360,-,0,-,"73,561,320"
38061020,Resin acids,324,-,0,-,"6,163"
38062010,Salts of rosin or of resin acids,58498,-,0,-,"559,636"
38062090,Salts of derivatives of rosin or resin acids,115,-,0,-,"2,823"
38063000,Ester gums,7215461,-,0,-,"14,028,019"
38069000,"Derivatives of rosin&resin acids, nes; rosin spirit&oils, nes",4213926,-,0,-,"16,254,772"
38070000,Wood tar&its oils; wood creosote&naphtha; vegetable&brewers¡¯s pitch.,216165,-,0,-,"368,901"
38086900,"Goods specified in Subheading Note 2 of Chapter 38, in packings of net weight£¾7.5kg",300549,-,0,-,"1,767,164"
38089112,Biopesticide in retail packagings,14516,-,0,-,"183,318"
38089119,Other insecticides in retail packagings,1398016,-,0,-,"22,307,467"
38089190,"Insecticides, not in retail packagings",8329207,-,0,-,"106,306,468"
38089210,Fungicides in retail packagings,1961601,-,0,-,"10,500,686"
38089290,"Fungicides, not in retail packagings",25827874,-,0,-,"263,938,887"
38089311,"Herbicides, in retail packagings",13396092,-,0,-,"34,825,497"
38089319,"Herbicides, not in retail packagings",8372927,-,0,-,"94,096,451"
38089391,"Anti-sproutng prod/plant growth regulators, in retail packagings",114549,-,0,-,"972,312"
38089399,"Anti-sproutng prod/plant growth regulators, not in retail packagings",187639,-,0,-,"11,434,489"
38089400,"Disinfectants,nes",23199412,-,0,-,"132,035,051"
38089910,"Rodenticides similar prdct, in retail packagings",284294,-,0,-,"803,076"
38089990,"Rodenticides&similar prdct, not in retail packagings",132356,-,0,-,"2,281,528"
38091000,"Finishing agents,dye carriers&othr prdct&prep., with amylaceous basis",2187445,-,0,-,"1,925,775"
38099100,"Finishing agents,dye carriers&othr prdct&prep., used in textile industry",71627266,-,0,-,"232,222,736"
38099200,"Finishing agents,dye carriers&othr prdct&prep., used in paper industry",43052073,-,0,-,"84,540,916"
38099300,"Finishing agents,dye carriers&othr prdct&prep., used in leather industry",48422500,-,0,-,"158,760,340"
38101000,Pickling prep. for metal surfaces;soldering/brazing/welding powder&pastes,10458321,-,0,-,"134,062,882"
38109000,"Prep. such as fluxes for soldering /brazing/welding, nes",15853263,-,0,-,"88,561,106"
38111900,Anti-knock prep. (excl. based on lead),363817,-,0,-,"2,899,692"
38112100,Additives for lubricating oils with petroleum oils,300451551,-,0,-,"931,039,818"
38112900,Additives for lubricating oils (excl. with petroleum oils),21501360,-,0,-,"76,358,495"
38119000,"oxidation inhibitors&othr additives, nes, for mineral oils/same purpose oils",23928512,-,0,-,"111,676,479"
38121000,Prepared rubber accelerators,20875904,-,0,-,"81,360,516"
38122000,"Compound plasticisers for rubber or plastics, nes",54166573,-,0,-,"124,612,991"
38123100,"Mixtures of oligomers of 2,2,4-trimethyl-1,2-dihydroquinoline (TMQ)",690067,-,0,-,"1,259,136"
38123910,Other rubber antioxidants,6462914,-,0,-,"28,345,303"
38123990,"Anti-oxidizing preparations and other compound stabilizers for rubber/plastics, nes",57407812,-,0,-,"288,229,559"
38130010,Preparations and charges for fire-extinguishers,4002777,-,0,-,"6,431,427"
38130020,Charged fire-extinguishing grenades,3779,-,0,-,"220,834"
38140000,"Organic composite solvents&thinners, nes; paint or varnish removers",20555864,-,0,-,"100,094,813"
38151100,Supported catalysts with nickel or its compounds,7710055,-,0,-,"149,100,199"
38151200,Supported catalysts with precious metal or its compounds,3445972,-,0,-,"600,564,827"
38151900,"Supported catalysts, nes",31706366,-,0,-,"469,558,573"
38159000,"Reaction initiators, accelerators&catalytic prep., nes",21638287,-,0,-,"357,600,008"
38160000,"Refractory cements, mortars, concretes&similar compositions, nes",34063660,-,0,-,"42,719,126"
38170000,"Mixed alkylbenzenes and alkylnaphthalenes, nes",29892772,-,0,-,"36,717,529"
38180011,"Monocrysta silicon disk/wafer, 7.5cm¡Üd.¡Ü15.24cm, doped for electronics",174467,-,100893270,-,"106,797,829"
38180019,"Monocrystal silicon disk/wafer, d.>15.24cm, doped for electronics",2206313,-,188609261,-,"950,502,538"
38180090,"Chemical elements disk/wafer&compounds, doped for lectronics, nes",2661238,-,0,-,"272,050,578"
38190000,Hydraulic brake fluids&similar liquids with<70% petroleum oil,23726050,-,0,-,"76,611,759"
38200000,Anti-freezing prep.&prepared de-icing fluids,18358336,-,0,-,"44,335,829"
38210000,"Prepared culture media for micro-organisms,plant,human or animal cells",3958382,-,0,-,"153,491,422"
38220010,Diagnostic or laboratory reagents on a backing,2934276,-,0,-,"338,234,181"
38220090,"Prepared diagnostic or laboratory reagents, nes",8464737,-,0,-,"1,205,064,751"
38231100,Industrial stearic acid,241113912,-,0,-,"213,995,293"
38231200,Industrial oleic acid,23913138,-,0,-,"27,067,791"
38231300,Industrial tall oil fatty acids,17332034,-,0,-,"18,302,574"
38231900,"Industrial monocarboxylic fatty acids;acid oils from refinng, nes",444201154,-,0,-,"412,936,829"
38237000,Industrial fatty alcohols,344294078,-,0,-,"614,519,507"
38241000,Prepared binders for foundry moulds or cores,2177503,-,0,-,"5,453,817"
38243000,Non-agglomeratd metal carbides mixd together or with metllic binders,252014,-,0,-,"11,945,005"
38244010,High performance water-reducing agent,5599116,-,0,-,"7,937,626"
38244090,"Other prepared additives for cements, mortars or concretes",7087367,-,0,-,"17,819,074"
38245000,Non-refractory mortars&concretes,33385973,-,0,-,"8,206,336"
38246000,Sorbitol (excl. that of 2905.44),100756,-,0,-,"118,494"
38247100,"Mixtures containing chlorofluorocarbons of meth-,eth- or prop-ane",53,-,0,-,"15,500"
38247500,Mixtures containing carbon tetrachloride,8,-,0,-,"1,577"
38247600,Mixtures containing methyl chloroform,12113,-,0,-,"107,857"
38247800,"Mixtures containing PFCs or HFCs, not CFCs or HCFCs",972666,-,0,-,"5,149,428"
38247900,"Mixtures containing halogenated derive. of meth-,eth- or prop-ane,nes",5930,-,0,-,"162,395"
38248100,Mixtures containing oxirane,18229,-,0,-,"111,693"
38248300,"Mixtures containing tris(2,3-dibromopropyl) phosphate",64000,-,0,-,"131,502"
38248400,Mixtures containing aldrin(ISO)/camphechlor(ISO)/chlordane(ISO)/chlordecone(ISO)/DDT(ISO) etc.,48000,-,0,-,"128,339"
38248600,Mixtures containing pentachlorobenzene (ISO) or hexachlorobenzene (ISO),222,-,0,-,"165,602"
38249100,"Mixtures consisting mainly of (5-ethyl-2-methyl-2-oxido-1,3,2-dioxaphosphinan-5-yl)methyl methyl methylphosphonate and bis[(5-ethyl-2-methyl-2-oxido-1,3,2-dioxaphosphinan-5-yl)methyl] methylphosphonate",494805,-,0,-,"4,613,976"
38249910,Fusel oil,868201,-,0,-,"769,452"
38249920,"Ink-removers, stencil correctors and the like",619340,-,0,-,"5,677,588"
38249930,Carburetant,182339,-,0,-,"98,336"
38249991,Mixtures containing talc£¾50% by weight,513245,-,0,-,"542,913"
38249992,Mixtures containing magnesium oxide£¾70% by weight,144767,-,0,-,"162,790"
38249993,Nickelous hydroxide(doped carbon) covered on the face side with cobalt compound,3305,-,0,-,"87,347"
38249999,"Chemical products and preparations of the chemical or allied industries, nes",1437284516,-,0,-,"6,069,583,699"
38259000,"Residual products of the chemical or allied industries, nes",67902559,-,0,-,"2,086,403"
38260000,"Biodiesel and mixtures thereof, without or with petroleum oils£¼70% by weight",15430462,-,17721077,-,"13,371,283"
39011000,"Polyethylene having a specific gravity£¼0.94, in primary forms",2374338875,-,0,-,"3,021,766,564"
39012000,"Polyethylene having a specific gravity¡Ý0.94, in primary forms",6394183464,-,0,-,"7,543,741,020"
39013000,"Ethylene-vinyl acetate copolymers, in primary forms",1035073424,-,0,-,"1,568,752,022"
39014010,"Ethylene-propylene copolymers having a specific gravity£¼0.94, in primary forms",12411701,-,0,-,"12,768,471"
39014020,"Linearity low density polyethylene having a specific gravity£¼0.94, in primary forms",3025970715,-,0,-,"3,651,507,245"
39014090,"Other ethylene-alpha-olefin copolymers having a specific gravity£¼0.94, in primary forms",224403379,-,0,-,"394,343,957"
39019010,"Ethylene-vinyl acetate copolymers, in primary forms, nes",79906815,-,0,-,"73,566,793"
39019090,"Other ethylene-vinyl copolymers, in primary forms, nes",332524502,-,0,-,"677,391,676"
39021000,"Polypropylene, in primary forms",3178230061,-,0,-,"3,844,371,826"
39022000,"Polyisobutylene, in primary forms",52691511,-,0,-,"84,854,388"
39023010,"Ethylene-propylene copolymers, in primary forms",1386690837,-,0,-,"1,728,235,572"
39023090,"Other ethylene-propylene copolymers, in primary forms, nes",180832912,-,0,-,"270,763,633"
39029000,"Other polymers of propylene or other olefins, in primary forms, nes",157274009,-,0,-,"507,304,700"
39031100,"Expansible polystyrene, in primary forms",33161969,-,0,-,"58,317,180"
39031910,"Modified polystyrene (excl.expansible), in primary forms",193065578,-,0,-,"307,504,553"
39031990,"Other polystyrene (excl.expansible), in primary forms",517666374,-,0,-,"735,937,347"
39032000,"Styrene-acrylonitrile (SAN) copolymers, in primary forms",267750081,-,0,-,"448,141,630"
39033010,"Modified acrylonitrile-butadiene-styrene(ABS) copolymers,in primary form",181149367,-,0,-,"405,266,587"
39033090,"Other acrylonitrile-butadiene-styrene(ABS) copolymers,in primary form",1608540652,-,0,-,"3,104,587,762"
39039000,"Polymers of styrene, in primary forms, nes",335425612,-,0,-,"742,159,898"
39041010,Paste resins,133968519,-,0,-,"155,840,254"
39041090,"Other poly, not mixed with any other substances",771584738,-,0,-,"711,139,677"
39042100,"Non-plasticised polyvinyl chloride mixed, in primary forms",18339471,-,0,-,"25,821,907"
39042200,"Plasticised polyvinyl chloride mixed, in primary forms",78594555,-,0,-,"159,927,106"
39043000,"Vinyl chloride-vinyl acetate copolymers, in primary forms",23706390,-,0,-,"45,650,170"
39044000,"Vinyl chloride copolymers (excl. acetate), in primary forms",7861802,-,0,-,"17,322,566"
39045000,"Vinylidene chloride polymers, in primary forms",5580104,-,0,-,"14,982,902"
39046100,"Polytetrafluoroethylene, in primary forms",6257854,-,0,-,"77,769,553"
39046900,"Fluoro-polymers (excl. polytetrafluoroethylene), in primary forms",12139212,-,0,-,"272,663,203"
39049000,"Polymers of halogenated olefins, in primary forms, nes",5254039,-,0,-,"14,215,310"
39051200,"Polyvinyl acetate, in aqueous dispersion",6577623,-,0,-,"8,961,632"
39051900,"Polyvinyl acetate, in other primary forms, nes",845941,-,0,-,"1,988,835"
39052100,"Vinyl acetate copylymers, in aqueous dispersion",62984058,-,0,-,"56,982,729"
39052900,"Vinyl acetate copylymers, in other primary forms, nes",4229119,-,0,-,"12,442,319"
39053000,"Polyvinyl alcohols, in primary forms",41080053,-,0,-,"111,002,206"
39059100,"Copolymers of vinyl esters/polymers, nes, in primary forms",16953354,-,0,-,"86,677,778"
39059900,"Vinyl/vinyl esters polymers, nes, in primary forms",41807802,-,0,-,"167,738,470"
39061000,"Polymethyl methacrylate, in primary forms",191884391,-,0,-,"494,612,560"
39069010,"Polyacrylamide prepared,in primary forms",20042767,-,0,-,"45,084,111"
39069090,"Acrylic polymers prepared,in primary forms, nes",735895794,-,0,-,"1,796,722,492"
39071010,Polyxymethylene inprimary forms,309702030,-,0,-,"609,424,724"
