Commodity code,Commodity,Quantity,Unit,Supplimentary Quantity,Supplimentary Unit,US dollar
84371010,"Color sorters of seed,grain or dried leguminous vegetables",51,-,0,-,"4,940,428"
84371090,"Other machines for cleaning, sorting or grading seed, grain or dried leguminous vegetables",712,-,0,-,"4,560,002"
84378000,Mach for mill/work of crls/ dried leguminous nes veg exc farm-typ,661,-,0,-,"3,961,866"
84379000,"Pts of cln/sort mach etc for sd/grn, mill/wrk of crls exc f-type",142904,-,0,-,"2,576,686"
84381000,"Bakery mach & machy for the mfg of macaroni, spaghetti¡äsim prods",4840,-,0,-,"85,246,449"
84382000,"Machy for the mfr of confectionary, cocoa¡ächocolate",286,-,0,-,"18,458,311"
84383000,Machinery for sugar manufacture,15,-,0,-,"4,326,388"
84384000,Brewery machinery,178,-,0,-,"1,106,232"
84385000,Machinery for the preparation of meat¡äpoultry,4601,-,1387250,-,"71,507,545"
84386000,"Machinery for the preparation of fruits, nuts¡ävegetables",13057,-,985204,-,"18,243,184"
84388000,Mach for ind prep/mfr of fd/ drk exc for extrac/prep veg fats/oils,21443,-,1772428,-,"77,309,735"
84389000,Parts of machinery of heading No. 84.38,489183,-,0,-,"18,272,200"
84391000,Machinery for making pulp of fibrous cellulosic material,49,-,0,-,"55,982,013"
84392000,Machinery for making paper¡äpaperboard,58,-,0,-,"77,729,065"
84393000,Machinery for finishing paper¡äpaperboard,197,-,0,-,"44,325,432"
84399100,Parts of mach for making pulp of fibrous cellulosic material,1559995,-,0,-,"40,695,226"
84399900,Parts of mach for making¡äfinishing paper¡äpaperboard mach,4477453,-,0,-,"144,826,763"
84401010,Sewing bookbinders,157,-,0,-,"9,002,092"
84401020,Glueing bookbinders,267,-,0,-,"19,052,380"
84401090,"Book-binding machinery, nes",3759,-,0,-,"35,936,433"
84409000,Parts of book-binding machinery incl book-sewing machines,75494,-,0,-,"3,923,442"
84411000,"Cutting machines for paper pulp, paper¡äpaperboard of all kinds",7443,-,0,-,"54,989,353"
84412000,"Machines for making bags, sacks¡äenvelopes of paper¡äpaperboard",16,-,0,-,"22,609,633"
84413010,Machines for making tins of paper-plastic-aluminium combination,4,-,0,-,"1,716,594"
84413090,"Mach f make boxes/sim cont,of paper/pboard o/t by moulding, nes",212,-,0,-,"26,002,824"
84414000,"Machines for moulding articles in paper pulp, paper¡äpaperboard",84,-,0,-,"8,777,024"
84418010,Machines for makng soft packings of paper-plastic-aluminm combinatn,20,-,0,-,"159,114"
84418090,"Machinery for making up paper pulp, paper¡äpaperboard nes",249,-,0,-,"40,993,155"
84419010,Parts of paper cutting machines,626473,-,0,-,"16,565,352"
84419090,"Parts of other machines for making paper pulp, paper¡äpaperboard",780136,-,0,-,"29,200,292"
84423010,Machinery for type casters,21,-,0,-,"1,321,139"
84423021,Machines for preparing CTP plates,342,-,0,-,"31,931,941"
84423029,"Other machinery,apparatus and equipment for typesetting",62,-,0,-,"15,368,565"
84423090,"Other machinery,apparatus and equipment for 84.42",63,-,0,-,"631,380"
84424000,Parts of machinery/apparatus/equipment under subheading 8442.30,104905,-,0,-,"6,273,580"
84425000,"Plates, cylinders and other printing components; plates, cylinders and lithographic stones, prepared for printing purposes (for example, planed, grained or polished)",680825,-,0,-,"21,286,911"
84431100,Reel fed offset printing machinery,41,-,0,-,"11,252,413"
84431200,"Sheet fed, office type (sht size ¡Ü22x36 cm) offset print mach",7,-,0,-,"4,160"
84431311,"Offset printing machinery, sheet fed, single color",87,-,0,-,"277,353"
84431312,"Offset printing machinery, sheet fed, two colors",54,-,0,-,"4,929,090"
84431313,"Offset printing machinery, sheet fed, four colors",287,-,0,-,"119,232,353"
84431319,"Other offset pring machinery, sheet fed",493,-,0,-,"371,619,623"
84431390,Other offset printing machinery,100,-,0,-,"34,411,661"
84431400,"Letterpress printing machinery,reel fed,excluding flexographic printing",31,-,0,-,"6,893,824"
84431500,"Letterpress printing machinery,reel fed,other than reel fed",37,-,0,-,"6,357,817"
84431600,Flexographic printing machinery,57,-,0,-,"41,683,043"
84431700,Gravure printing machinery,40,-,0,-,"17,317,791"
84431921,Cylinder screen press,31,-,0,-,"12,490,165"
84431922,Platen screen press,570,-,0,-,"49,766,240"
84431929,Other screen printing machinery,217,-,0,-,"10,177,839"
84431980,Other printing machinery used for printing cylinders etc.,240,-,0,-,"19,097,953"
84433110,Electrostatic photosensitive-type machines,4546223,-,0,-,"804,204,972"
84433190,Other machines which perform two or more of the functions,2081542,-,0,-,"178,521,771"
84433211,"Stylus printers,of a kind solely used in the machines of heading 84.71",336087,-,0,-,"54,675,081"
84433212,"Laser printers,of a kind solely used in the machines of heading 84.71",3440600,-,0,-,"353,368,717"
84433213,"Ink-jet printers,of a kind solely used in the machines of heading 84.71",984890,-,0,-,"65,787,301"
84433214,"Thermo-printers, of a kind solely used in the machines of heading 84.71",507191,-,0,-,"111,365,534"
84433219,"Other printers,of a kind solely used in the machines of heading 84.71",214810,-,0,-,"76,858,388"
84433221,"Ink-jet digital printing machines, capable of connecting to an automatic data processing machine or to a network",150820,-,0,-,"235,150,751"
84433222,"Electrostatic photographic printing machines,capable of connecting to an automatic data processing machine or to a network",43299,-,0,-,"85,044,184"
84433229,Other digital printing machines,17919,-,0,-,"23,638,015"
84433290,"Other printers,copying machines and facsimile machines",948400,-,0,-,"143,655,404"
84433912,Indirectly process electrostatic photo-copying apparatus,21,-,0,-,"15,849"
84433921,Photo-copying apparatus incorporating an optical system,1,-,0,-,"89,100"
84433923,Thermo-copying apparatus,26,-,0,-,"6,694"
84433931,Ink-jet digital printing machines,220,-,0,-,"4,170,354"
84433932,Electrostatic photographic printing machines,7,-,0,-,"282,785"
84433939,Other digital printing machines,106183,-,0,-,"3,077,085"
84433990,"Other printers,copying machines and facsimile machines",32653,-,0,-,"5,817,138"
84439111,Web feeder for machines under sub-heading 84.42,7729,-,8,-,"448,220"
84439119,Other machines for uses ancillary to printing,204598,-,106,-,"10,703,218"
84439190,Other parts and accessories of printing machinery of heading 84.42,8704958,-,5208203,-,"63,144,799"
84439910,Machines for uses ancillary to digital printing machines,183519,-,3559,-,"9,943,157"
84439921,Thermo-print heads for digital printing machines,253803,-,12874746,-,"101,802,366"
84439929,Other parts and accessories for digial printing machines,2274942,-,0,-,"438,848,725"
84439990,Other parts and accessories of heading 84.43,139664683,-,0,-,"4,184,623,831"
84440010,Synthetic filament spinning jets,135,-,0,-,"117,234,299"
84440020,Synthetic staple fibres spinning jets,5,-,0,-,"2,691,774"
84440030,Artificial fibres spinning jets,1,-,0,-,"67,655"
84440040,Man-made filament crimping machinery,151,-,0,-,"88,312,509"
84440050,Man-made filament cutting machinery,100,-,0,-,"3,551,179"
84440090,Machines for extrud/draw/texture/cut man-made textile mat.nes,3920,-,0,-,"179,199,509"
84451111,"Blowing-carding machinery, for cotton type fibres",2,-,0,-,"2,526,772"
84451112,"Bale plucker, for cotton type fibres",1,-,0,-,"66,283"
84451113,"Card or carding machine, for cotton type fibres",353,-,0,-,"1,356,898"
84451119,"Carding machines, for cotton type fibres",39,-,0,-,"56,176"
84451120,"Carding machines, for wool type fibres",50,-,0,-,"10,174,700"
84451190,"Other carding machines, nes",125,-,0,-,"55,683,299"
84451210,Cotton Comber,10,-,0,-,"1,334,607"
84451220,Worsted comber,146,-,0,-,"6,755,373"
84451290,Textile combing machines,8,-,0,-,"217,351"
84451310,Drawing machines,28,-,0,-,"607,383"
84451321,Cotton Roving Frames,107,-,0,-,"22,585,324"
84451322,Worsted Roving Machines,18,-,0,-,"3,514,282"
84451329,Other cotton Roving machines,8,-,0,-,"180,779"
84451900,"Textile preparing machines, nes",291,-,0,-,"37,363,492"
84452031,Rotor Spinning Machine,66,-,0,-,"56,745,062"
84452032,Jet spinner,233,-,0,-,"91,730,217"
84452039,Other open-end spinner,150,-,0,-,"58,676,051"
84452041,Cotton Ring Spinning Frame,271,-,0,-,"41,942,994"
84452042,Worsted Ring Spinning Frame,79,-,0,-,"17,642,334"
84452049,Other Ring spinning frames,38,-,0,-,"3,401,522"
84452090,"Other textile spinning machines, nes",17,-,0,-,"922,171"
84453000,Textile doubling¡ätwisting machines,151,-,0,-,"16,550,663"
84454010,Automatic bobbin winders,2143,-,0,-,"319,529,545"
84454090,Other textile winding or reeling machines,1205,-,0,-,"21,763,967"
84459010,Warping machines,40,-,0,-,"7,187,689"
84459020,Sizing machines,28,-,0,-,"11,305,390"
84459090,"Other machines for producing¡äpreparing textile yarn, nes",184,-,0,-,"34,667,764"
84461000,Machines for weaving fabrics of a width ¡Ü30 cm,165,-,0,-,"4,462,228"
84462190,"Power looms for weaving fabrics of width¡µ30 cm, nes,shuttle type",17,-,0,-,"653,858"
84462900,Machines for weaving fabrics of a width ¡µ30 cm shuttle type nes,192,-,0,-,"92,208"
84463020,"Rapier looms for weaving fabrics of a width¡µ30cm, shuttless",3102,-,0,-,"192,575,931"
84463030,"Carrier looms for weaving fabrics of a width¡µ30cm, shuttless",250,-,0,-,"6,662,822"
84463040,"Water jet looms for weaving fabrics of a width¡µ30cm, shuttless",1145,-,0,-,"24,581,962"
84463050,"Air jet looms for weaving fabrics of a width¡µ30cm, shuttless",4276,-,0,-,"177,544,359"
84463090,"Machines for weaving fabrics of a width¡µ30cm, shuttleless nes",5,-,0,-,"202,686"
84471100,Circular knitting machines with cylinder diameter¡Ü165 mm,1852,-,0,-,"38,037,997"
84471200,Circular knitting machines with cylinder diameter¡µ165 mm,461,-,0,-,"27,049,302"
84472011,Tricot warp knitting machines,375,-,0,-,"62,570,437"
84472012,Raschel warp knitting machines,91,-,0,-,"24,626,133"
84472019,Other warp knitting machines,4,-,0,-,"425,357"
84472020,Flat weftknitting machines,7938,-,0,-,"285,066,419"
84472030,Stitch-bonding machines,32,-,0,-,"1,070,085"
84479011,Tufting machines for making carpets or rugs,47,-,0,-,"18,069,109"
84479019,Other tufting machines,27,-,0,-,"770,585"
84479020,Embroidery machines,560,-,0,-,"20,412,407"
84479090,Machines for making gimped yarn/tulle/lace/trimmings/braid/net,115,-,0,-,"10,512,917"
84481100,"Dobbies,Jacquards,card reducing,for machines of 84.44,45,46,47",2071304,-,0,-,"49,012,216"
84481900,"Auxiliary machy nes for machins of 84.44,84.45,84.46,84.47",1845651,-,0,-,"43,260,372"
84482020,Extruding nipples or spinnerets,459752,-,143031,-,"29,943,398"
84482090,"Pts/accessories of mach of 84.44/thr auxiliary machy, nes",576522,-,0,-,"44,878,433"
84483100,Card clothing for hdg No 84.45,1187616,-,0,-,"28,981,091"
84483200,"Parts/accessories of machns for prep textile fibres, nes",878452,-,0,-,"32,865,938"
84483310,Wirding unit for automatic winder,49098,-,781526,-,"13,502,662"
84483390,"Spindles,spindle flyers,spinning rings and ring travellers",816985,-,0,-,"24,697,008"
84483910,Open-end rotors of mach of 84.45¡äof their auxiliary machines,21264,-,348,-,"120,465"
84483920,Electronic cleaner for automatic wnder,65229,-,33347,-,"17,340,076"
84483930,Air splicer for automatic winder,86510,-,71664,-,"7,212,016"
84483940,Close spinning device of ring spinning frames,44505,-,55726,-,"2,955,696"
84483990,"Parts/accessories of machines of 84.45/thr auxiliary machines, nes",5252487,-,0,-,"122,109,593"
84484200,"Reeds for looms, healds & heald-frames for weaving machines (looms)",447165,-,0,-,"18,660,249"
84484910,Picking and receiving unit for projective weaving machine,101,-,153,-,"19,329"
84484920,Weft insertion and left-off motion for air-je loom,3701,-,50665,-,"1,515,964"
84484930,Shuttles for weaving machines (looms),53606,-,13348,-,"744,967"
84484990,Parts & accessories of weaving mches¡äof their auxiliary mach nes,1907599,-,0,-,"67,023,133"
84485120,"Beard needles, crotchet hooks for knitting machines, gauge No.<28",294772,-,0,-,"117,722,712"
84485190,"Sinkers, needles/oth articles used in form stitches",419585,-,0,-,"84,430,715"
84485900,Other parts/accessories of machns of 84.47/their auxiliary machinery,4634580,-,0,-,"118,922,251"
84490010,Machinery for stitich,118103523,-,1526016,-,"36,262,503"
84490020,Spunlaced equiqment,1685,-,699832,-,"29,161,634"
84490090,Other machinery for working felt/nonwovens (incl. felt hats),1897486,-,0,-,"48,591,175"
84501110,"Full-auto machines of the continuously rotating impeller, dry linen wt.¡Ü10 kg",5466,-,0,-,"1,299,545"
84501120,"Full-auto machines of the drum type, dry linen wt.¡Ü10 kg",147534,-,0,-,"56,553,698"
84501190,"Full-automatic washing machines, of a dry linen capacity ¡Ü10 kg",769,-,0,-,"343,608"
84501200,"Other washing mach, dry linen capacity¡Ü10kg, with built-in dryer",25,-,0,-,"87,933"
84501900,"Other washing machines of a dry linen capacity¡Ü10kg, nes",7,-,0,-,"1,240"
84502011,"Full-automatic washing maching of the continuously rotating impeller,dry linen wt.£¾10 kg",5326,-,0,-,"2,440,836"
84502012,"Full-automatic washing maching of the drum type,dry linen wt.£¾10 kg",28379,-,0,-,"25,514,103"
84502019,"Other full-automatic washing maching,dry linen wt.£¾10 kg",829,-,0,-,"2,940,296"
84502090,"Non-automatic washing maching,dry linen wt.£¾10 kg",694,-,0,-,"604,292"
84509010,"Parts of washing machines, dry linen capacity¡Ü10kg",4255152,-,0,-,"48,647,648"
84509090,"Parts of washing machines, dry linen capacity£¾10kg",203189,-,0,-,"5,694,472"
84511000,Dry-cleaning machines o/t hdg No 84.50,500,-,0,-,"2,719,893"
84512100,Drying machines (o/t hdg No 84.50) each of a dry linen cap¡Ü10 kg,142327,-,0,-,"72,313,765"
84512900,Drying machines (o/t No 84.50) nes,3291,-,0,-,"22,652,691"
84513000,Ironing machines & presses (including fusing presses),2553,-,0,-,"18,424,535"
84514000,"Washing, bleaching¡ädyeing machines",1729,-,0,-,"118,754,166"
84515000,"Machines for reeling,unreeling,folding,cut¡äpink textile fabrics",5474,-,0,-,"85,463,382"
84518000,Machines for wring/dress/finishing/coating¡äimpreg tex yarns etc,4325,-,0,-,"198,053,795"
84519000,Parts of machinery of heading No. 84.51,1227522,-,0,-,"29,374,710"
84521010,Multifunctional household type sewing machines,71837,-,0,-,"5,451,961"
84521091,Hand-operated sewing machines of household type,565,-,0,-,"69,093"
84521099,Other sewing machines of household type,1795,-,0,-,"168,578"
84522110,"Non-household type automatic sewing machines, flatseam",2476,-,0,-,"13,076,126"
84522120,Non-household type automatic overlock machine,1264,-,0,-,"1,750,122"
84522130,Non-household type automatic interlock machine,1317,-,0,-,"2,731,190"
84522190,Other non-household type automatic sewing machines nes,32434,-,0,-,"109,363,959"
84522900,"Sewing machines, other than book-sewing machines, nes",5243,-,0,-,"8,877,464"
84523000,Sewing machine needles,130991,-,0,-,"8,945,518"
84529011,Rotating shuttles of household sewing machines,23246,-,0,-,"1,881,295"
84529019,"Parts of household sewing machines, nes",435306,-,0,-,"12,785,687"
84529091,Rotating shuttles of non-household sewing machines,56815,-,0,-,"14,929,125"
84529092,Furniture/bases/covers and parts thereof for non-household sewing machines,8635,-,0,-,"72,979"
84529099,"Parts of non-household sewing machines, nes",1182981,-,0,-,"47,318,967"
84531000,"Machinery for preparing,tanning¡äworking hides, skins¡äleather",683,-,0,-,"30,562,313"
84532000,Machinery for making¡ärepairing footwear,718,-,0,-,"16,079,943"
84538000,"Mach for making¡ärepair art of hides,skins¡äleather nes",296,-,0,-,"4,808,454"
84539000,Parts of machinery of heading No. 84.53,215915,-,0,-,"6,095,548"
84541000,Converters used in metallurgy¡ämetal foundries,15,-,0,-,"273,606"
84542010,Out furnace refining equipment,27,-,0,-,"9,472,524"
84542090,"Ingot moulds & ladles used in metallurgy¡ämetal foundries, nes",238,-,0,-,"4,244,449"
84543010,Cold chamber die-casting machines,222,-,0,-,"162,937,817"
84543021,Ingot block continuous casting machines,1,-,0,-,"48,163"
84543029,Other ingot continuous casting machines nes,1,-,0,-,"1,983,030"
84543090,"Casting machines used in metallurgy¡ämetal foundries, nes",317,-,0,-,"109,102,716"
84549010,Parts of out furnace refining equipment,131993,-,0,-,"1,137,969"
84549021,Crystallizers for ingot continuous casting machines,91280,-,0,-,"5,672,839"
84549022,Vibrating devices for ingot continuous casting machines,20560,-,0,-,"889,238"
84549029,Other parts for ingot continuous casting machines,383373,-,0,-,"29,941,199"
84549090,Parts of other machines of heading No. 84.54,1630746,-,0,-,"47,925,229"
84551010,Hot-rolling tube mills,3,-,0,-,"851,821"
84551020,Cold-rolling tube mills,10,-,0,-,"13,375,933"
84551030,Tube rolling mill with capacity to rix-reduce diameter,4,-,0,-,"1,781,405"
84552110,Hot-rolling flat mills,2,-,0,-,"1,458,160"
84552120,Rolling mills for shapes and sections,1,-,0,-,"14,493"
84552130,Rolling mills for bars and rods in coils,12,-,0,-,"8,313,863"
84552190,"Hot or combination hot and cold metal rolling mills, nes",3,-,0,-,"3,043,801"
84552210,Cold-rolling flat mills,35,-,0,-,"19,736,696"
84552290,"Cold metal rolling mills, nes",32,-,0,-,"41,162,288"
84553000,Rolls for metal rolling mills,12691,-,0,-,"67,574,328"
84559000,Parts of metal rolling mills & rolls,2700302,-,0,-,"70,022,051"
84561100,Machine-tools operatd by laser process,6599,-,12946858,-,"882,859,390"
84561200,Machine-tools operatd by other light or photon beam processes,56,-,91281,-,"6,912,419"
84562000,Machine-tools operatd by ultrasonic processes,391,-,0,-,"13,462,056"
84563010,"Machine-tools operatd by electro-discharge processe, numerically contrlld",2254,-,0,-,"200,637,746"
84563090,"Machine-tools operatd by electro-discharge procsse, not numericly contrld",47,-,0,-,"1,119,975"
84564010,Cutting machines of plasma arc,2501,-,784211,-,"25,377,713"
84564090,Other machine-tools operatd by plasma arc process,6,-,12844,-,"435,548"
84565000,Water-jet cutting machines,77,-,316185,-,"12,129,409"
84569000,"Machine-tools operatd by electro-chemical, electron beam or ionic-beam process",82,-,192861,-,"23,105,894"
84571010,Vertical machining centres,30009,-,0,-,"1,814,761,203"
84571020,Horizontal machining centres,2528,-,0,-,"1,130,522,000"
84571030,Plano machining centres,646,-,0,-,"327,249,888"
84571091,Mill-Turn machining centres,162,-,0,-,"89,004,055"
84571099,"Machining centres,nes",62,-,0,-,"28,304,603"
84572000,Unit construction machines (single station),74,-,0,-,"12,725,844"
84573000,Multi-station transfer machines,239,-,0,-,"140,009,811"
84581100,Horizontal lathes numerically controlled,3967,-,0,-,"416,322,267"
84581900,Horizontal lathes nes,2207,-,0,-,"16,927,446"
84589110,Vertical lathes numerically controlled,1463,-,16502031,-,"229,241,362"
84589120,Lathes nes numerically controlled,26,-,233701,-,"7,714,559"
84589900,Lathes nes for removing metal,395,-,0,-,"6,639,053"
84591000,Way-type unit head machines,19,-,0,-,"1,392,511"
84592100,"Drilling machines nes, numerically controlled",795,-,0,-,"85,052,151"
84592900,"Drilling machines nes, for removing metal",1258,-,0,-,"2,492,784"
84593100,"Boring-milling machines nes, numerically controlled",57,-,0,-,"28,960,959"
84593900,Boring-milling machines nes for removing metal,25,-,0,-,"2,376,685"
84594100,"Boring machines, numerically controlled",39,-,489237,-,"15,605,445"
84594900,Other boring machines,18,-,108359,-,"1,209,792"
84595100,"Milling mach, knee-type numerically controlled",17,-,0,-,"2,571,651"
84595900,"Milling mach, knee-type nes for removing metal",238,-,0,-,"2,857,133"
84596110,"Planomilling machines , numerically controlled",408,-,0,-,"110,651,962"
84596190,"Milling machines nes, numerically controlled",592,-,0,-,"101,587,829"
84596910,"Planoilling machines, not numerically controlled",4,-,0,-,"892,165"
84596990,"Milling machines nes, not numerically controlled",464,-,0,-,"6,116,317"
84597000,Threading¡ätapping machines nes for removing metal,495,-,0,-,"6,693,070"
84601210,"Flat-surface grinding machines, numerically controled, accuracy at least 0.01mm",410,-,2855438,-,"66,110,536"
84601290,"Other flat-surface grinding machines, numerically controled",19,-,148530,-,"3,860,293"
84601910,"Other flat-surface grinding machines, accuracy at least 0.01mm",959,-,1142484,-,"13,570,924"
84601990,"Flat-surface grinding machines, nes",81,-,85465,-,"2,966,590"
84602210,"Centreless grinding machines, numerically controlled, accuracy at least 0.01mm",139,-,1319173,-,"44,384,441"
84602290,"Other centreless grinding machines, numerically controled",4,-,26192,-,"1,229,044"
84602311,"Crank shaft grinding machines, numerically controlled, accuracy at least 0.01mm",45,-,1121567,-,"31,781,471"
84602319,"Other cylindrical grinding machines, numerically controlled, accuracy at least 0.01mm",481,-,4922578,-,"206,139,954"
84602390,"Other cylindrical grinding machines, numerically controled",14,-,78829,-,"2,585,345"
84602411,"Internal grinding machines, numerically controlled, accuracy at least 0.01mm",216,-,1222480,-,"61,996,575"
84602419,"Other grinding machines, numerically controlled, accuracy at least 0.01mm",303,-,2695133,-,"119,416,251"
84602490,"Other grinding machines, numerically controlled",8,-,148685,-,"5,348,776"
84602911,"Other cylindrical grinding machines, accuracy at least 0.01mm",133,-,348708,-,"5,996,277"
84602912,"Other internal grinding machines, accuracy at least 0.01mm",15,-,43073,-,"1,163,206"
84602913,"Other grinding machines of roll, accuracy at least 0.01mm",4,-,28287,-,"420,223"
84602919,"Other grinding machines, nes, accuracy at least 0.01mm",40,-,85040,-,"1,604,277"
84602990,"Other grinding machines, nes",245,-,587248,-,"7,199,387"
84603100,"Sharpening (tool/cutter grinding) machines, numerically controlled",1475,-,0,-,"245,993,019"
84603900,"Sharpening (tool¡äcutter grinding) machines, not numericl contrld",516,-,0,-,"4,698,035"
84604010,Honing machines,221,-,0,-,"69,361,231"
84604020,Lapping machines,1416,-,0,-,"49,306,894"
84609010,Grinding wheel mechines,1527,-,0,-,"6,456,419"
84609020,Polishing machines,824,-,0,-,"44,105,328"
84609090,"Mach-tools for finishing metals with polishng prod, nes",1322,-,0,-,"26,850,006"
84612010,Shaping machines,3,-,0,-,"21,775"
84612020,Slotting machines,2,-,0,-,"45,580"
84613000,Broaching machines,131,-,0,-,"47,415,585"
84614011,"Gear grinding machines,numerically-controlled",231,-,0,-,"167,640,062"
84614019,"Gear cutting/fishing machines,numerciallly-controlled",340,-,0,-,"141,548,944"
84614090,"Gear cutting/grinding/finishing machns, not numerical contrld",193,-,0,-,"7,787,315"
84615000,Sawing¡äcutting-off machines by removing metal,3465,-,0,-,"74,277,039"
84619019,"Other planing machines, nes",15,-,0,-,"786,683"
84619090,"Other machines-tools working by removing metal, nes",2680,-,0,-,"11,995,323"
84621010,"Forging¡ädie-stamping mach & hammers,numerically controlled",700,-,0,-,"336,953,843"
84621090,"Forging¡ädie-stamping mach & hammers, not numerically contrld",1523,-,0,-,"153,156,025"
84622110,"Straightenning machines, numericly contrld",114,-,0,-,"26,286,621"
84622190,"Bending, folding or flattening machines, numericly contrld",932,-,0,-,"186,063,297"
84622910,"Straightenning machines, not numerically controlled",222,-,0,-,"8,006,108"
84622990,"Bending, folding or flattening machines, not numricl contrld",914,-,0,-,"42,905,819"
84623110,"Lengthwise shearing machine, numerically controlld",52,-,0,-,"31,584,326"
84623120,"Transverse shearing machine, numerically controlld",45,-,0,-,"27,056,724"
84623190,"Other shearing machine, numerically controlld",125,-,0,-,"16,722,861"
84623910,"Lengthwise shearing machine, not numrically controlled",27,-,0,-,"3,059,370"
84623920,"Transverse shearing machine, not numrically controlled",19,-,0,-,"6,615,561"
84623990,"Other shearing machine, not numrically controlled",307,-,0,-,"7,471,420"
84624111,CNC automatic tool change punch press,182,-,0,-,"77,050,680"
84624119,"Other punch press, nes",296,-,0,-,"77,083,046"
84624190,"Punching/notching machines, numerically controlled",192,-,0,-,"32,612,773"
84624900,"Punching/notching machines, not numerically controlled",955,-,0,-,"37,465,228"
84629110,"Metal section squeezing machine, hydraulic",130,-,0,-,"12,413,210"
84629190,Hydraulic presses nes,1343,-,0,-,"81,252,861"
84629910,Mechanical presses,839,-,0,-,"57,260,316"
84629990,Presses nes for working metal,994,-,0,-,"65,655,921"
84631011,"Cold-drawing tube benches, drawing force¡Ü300t",14,-,0,-,"2,875,306"
84631020,Wiredrawing machines,143,-,0,-,"22,517,817"
84631090,"Other draw-benches for bars/tubes/profiles/wire, nes",109,-,0,-,"13,939,127"
84632000,Thread rolling machines,528,-,0,-,"16,031,830"
84633000,Machines for working metal wire,699,-,0,-,"33,878,277"
84639000,"Machine-tools for workg metals without removing material, nes",1560,-,0,-,"133,798,998"
84641010,Sawing machine of disk saw,1070,-,0,-,"1,077,271"
84641020,Sawing machine of scroll saw,55,-,0,-,"16,564,483"
84641090,"Other sawing machine, nes",1573,-,0,-,"9,103,017"
84642010,Grindg/polish mach for grinding or polishing glass or glassware,3771,-,0,-,"173,670,540"
84642090,"Other grinding or polishing machines, nes",3180,-,0,-,"54,816,523"
84649011,Cutting-off machines for cold-working glass or glassware,392,-,0,-,"94,177,411"
84649012,Carving machines for cold-working glass or glassware,36,-,0,-,"175,631"
84649019,"Other machines for cold-working glass or glassware, nes",233,-,0,-,"62,444,778"
84649090,"Other machine-tools for working stone, ceramics, concrete, nes",1192,-,0,-,"48,803,399"
